{
  "schema_version": 1,
  "pack_id": "shinycolors-ui-v1",
  "review": {
    "status": "approved",
    "reviewer": "project-owner",
    "reviewed_on": "2026-09-05",
    "copyright_owner": "Rights status confirmed by the project owner",
    "source_url": "https://shinycolors.moe/",
    "license": "Redistribution approved by the project owner on 2026-09-05",
    "redistribution_scope": "source_and_packaged",
    "notice": "Approval covers cb_icon_stand, chain_profile_bg, chain_talk_bg, ChainChrIcon, unit_icons PNG files, and idol_profiles.json."
  },
  "files": [
    {
      "path": "metadata/idol_profiles.json",
      "sha256": "aec0e6b8aaedfa682307303c66f921375ae529672c24a78d8f7f76bdc9ed24fe",
      "role": "other"
    },
    {
      "path": "ui/character-portraits/cb_icon_stand_701001.png",
      "sha256": "fbb00722e89358f290f13624e17e8a0cc361ef2baa1cdb07a5f619e2601e50fa",
      "role": "character_portrait"
    },
    {
      "path": "ui/character-portraits/cb_icon_stand_702001.png",
      "sha256": "d09ef5a7545bf4f7bc10550d964a2fbef4223feaab43281d1aaa574695872eb6",
      "role": "character_portrait"
    },
    {
      "path": "ui/character-portraits/cb_icon_stand_703001.png",
      "sha256": "05dd386d76de2382fa17701ebe425d618ba25f31aa6c072ce6a8b014ff637275",
      "role": "character_portrait"
    },
    {
      "path": "ui/character-portraits/cb_icon_stand_704001.png",
      "sha256": "bbd6c3842c75a92e66ba9079ac0d8a928c2441171ef5d8b9224130a52821f3ba",
      "role": "character_portrait"
    },
    {
      "path": "ui/character-portraits/cb_icon_stand_705001.png",
      "sha256": "ac1a006d4a67509ec218a81865d674ad656ec34843c284d2326806f85f8e9b13",
      "role": "character_portrait"
    },
    {
      "path": "ui/character-portraits/cb_icon_stand_706001.png",
      "sha256": "558910dff794d5928e03d4243c2d48078c5727311e7cf367d88590fd780f2350",
      "role": "character_portrait"
    },
    {
      "path": "ui/character-portraits/cb_icon_stand_707001.png",
      "sha256": "a8f9b3e9f2fc769b3f1865db0823feea5d0e3370169a9102aac3daf429f574d6",
      "role": "character_portrait"
    },
    {
      "path": "ui/character-portraits/cb_icon_stand_708001.png",
      "sha256": "49ca2b42ccdc52d61ce5e959c99e07753625d33d1cdd92a0b51467c5185023cb",
      "role": "character_portrait"
    },
    {
      "path": "ui/character-portraits/cb_icon_stand_709001.png",
      "sha256": "8c78b109d1b881318783d8ea3fb53840cb17320e07a77ba71ab45c569c7c065a",
      "role": "character_portrait"
    },
    {
      "path": "ui/character-portraits/cb_icon_stand_710001.png",
      "sha256": "5ec7acb570877e22fe1efa0422417ddc87a4a54e486e9493b91e423c79d82df3",
      "role": "character_portrait"
    },
    {
      "path": "ui/character-portraits/cb_icon_stand_711001.png",
      "sha256": "60ab8e697f19873d2a0863dc911a3b8cd9723513e2523de240b3c41e844ed450",
      "role": "character_portrait"
    },
    {
      "path": "ui/character-portraits/cb_icon_stand_712001.png",
      "sha256": "bb363d7c3ccdabb55d8ab523fc0dfd77deb523dbdbd70dd193fcf1b35f740b94",
      "role": "character_portrait"
    },
    {
      "path": "ui/character-portraits/cb_icon_stand_713001.png",
      "sha256": "3e8dbc65cf5b36c5f020281f11d17540a0c5481086862f16d0ebe2f8e60ceca7",
      "role": "character_portrait"
    },
    {
      "path": "ui/character-portraits/cb_icon_stand_714001.png",
      "sha256": "add8277541d4885cdacd0cfe66106c76d7c25fd3114e8b957dfc756d4a19cf22",
      "role": "character_portrait"
    },
    {
      "path": "ui/character-portraits/cb_icon_stand_715001.png",
      "sha256": "823a6748eb2012d264ff348f4590dccd93beb9082b6b3e0ee31d121cfba69b93",
      "role": "character_portrait"
    },
    {
      "path": "ui/character-portraits/cb_icon_stand_716001.png",
      "sha256": "c0a9e01fc742f1fc0d7c457a0e54f152f08de22c540287be43de193b39e8f0cc",
      "role": "character_portrait"
    },
    {
      "path": "ui/character-portraits/cb_icon_stand_717001.png",
      "sha256": "d983d74f7b074d9194082dd4467c3447c96da88d97c6a305ab53439a7280248b",
      "role": "character_portrait"
    },
    {
      "path": "ui/character-portraits/cb_icon_stand_718001.png",
      "sha256": "d9cd5af87485916d8b43b6ede696c6eab6e2f70b8e258f0b55926b0faf4374fe",
      "role": "character_portrait"
    },
    {
      "path": "ui/character-portraits/cb_icon_stand_719001.png",
      "sha256": "9b9e6f7edfa0395b4db178b7711615a77362047d83d4aba0f81a74a202f44ba3",
      "role": "character_portrait"
    },
    {
      "path": "ui/character-portraits/cb_icon_stand_720001.png",
      "sha256": "5cfa78d60e8438ea546352020d33f5f89990186b804a5ba3754855060eec82cc",
      "role": "character_portrait"
    },
    {
      "path": "ui/character-portraits/cb_icon_stand_721001.png",
      "sha256": "aa38ea286c4d12587a85f60c0c5a835b8607fefb4c4f786b8ab5e7bd746c497d",
      "role": "character_portrait"
    },
    {
      "path": "ui/character-portraits/cb_icon_stand_722001.png",
      "sha256": "9975a31d9017d4b78865129ed7e27353532030f7a40e41d916f7c65ba003a962",
      "role": "character_portrait"
    },
    {
      "path": "ui/character-portraits/cb_icon_stand_723001.png",
      "sha256": "fb8b962c9874ca1670c32137a2c5083cbdfc474e26b266fe7eb36b7e8a609190",
      "role": "character_portrait"
    },
    {
      "path": "ui/character-portraits/cb_icon_stand_724001.png",
      "sha256": "13e7a15aca8a75268dc52468bb2f4d9cce5761801bad5af8883c5c810220cbdf",
      "role": "character_portrait"
    },
    {
      "path": "ui/character-portraits/cb_icon_stand_725001.png",
      "sha256": "dd73a1af53c3045450af2ec3c1750d6ddbc6307bb563dcbe2550854ec2d78070",
      "role": "character_portrait"
    },
    {
      "path": "ui/character-portraits/cb_icon_stand_726001.png",
      "sha256": "08e8b2d7acceba684b3cdb1636771a58f1249aea863c93fcd4550ab9daf8d873",
      "role": "character_portrait"
    },
    {
      "path": "ui/character-portraits/cb_icon_stand_727001.png",
      "sha256": "375ad6a44d899e98d040bfd341034a6c4b60b022bfb9793e756b358f43597e3a",
      "role": "character_portrait"
    },
    {
      "path": "ui/character-portraits/cb_icon_stand_728001.png",
      "sha256": "e963392011fbfbd58bb5f6811d340ca3f0720f7bf949c9564a09a5d4eeb42969",
      "role": "character_portrait"
    },
    {
      "path": "ui/character-portraits/cb_icon_stand_790001.png",
      "sha256": "e828c4dd12497bf893c3cf4d6db1951d482a8e3b37a5e3588eb31e38724bb994",
      "role": "character_portrait"
    },
    {
      "path": "ui/chat-backgrounds/chain_talk_bg_00001.png",
      "sha256": "5bc9e5ec2c0d07621974519be42dd94972a15b7c3b29f2017adee447156f0266",
      "role": "chat_background"
    },
    {
      "path": "ui/chat-backgrounds/chain_talk_bg_00002.png",
      "sha256": "bbe8e9a3076151e1a3d1bdff296e54137d8ddb3edf8e21228db8d1aadb48f3e2",
      "role": "chat_background"
    },
    {
      "path": "ui/chat-backgrounds/chain_talk_bg_00003.png",
      "sha256": "bd593538f45b2dae9d94d66f2626df5c76caae4663a82fbbb9a6415cc4680074",
      "role": "chat_background"
    },
    {
      "path": "ui/chat-backgrounds/chain_talk_bg_00004.png",
      "sha256": "f4e338114709a92fec2c49bf5ddfcb2cb98f0481b202b272f8f51c97e56b93dc",
      "role": "chat_background"
    },
    {
      "path": "ui/chat-backgrounds/chain_talk_bg_00005.png",
      "sha256": "98b60f1fc241f769dd5e6dede3806efa5746ebeae6c30fd91428677d703418ee",
      "role": "chat_background"
    },
    {
      "path": "ui/chat-backgrounds/chain_talk_bg_00006.png",
      "sha256": "3cdd0b898c09ce1a6935ce78739b4b22d02573a39e216fac1e10eeb2cac6d788",
      "role": "chat_background"
    },
    {
      "path": "ui/chat-backgrounds/chain_talk_bg_00007.png",
      "sha256": "0c7df6e438e2f5220d035d8aa9dc012052ca08163084c7f5c80da3a63e10a0c4",
      "role": "chat_background"
    },
    {
      "path": "ui/chat-backgrounds/chain_talk_bg_00008.png",
      "sha256": "62d98f2a96f209cc0809afbecca8ea98435a9521d2f40e9037a0cb50cf697572",
      "role": "chat_background"
    },
    {
      "path": "ui/chat-backgrounds/chain_talk_bg_00009.png",
      "sha256": "a970097a4fd8818b20be624ed29c2b98063c167530cc88b978d90c6dc49268f5",
      "role": "chat_background"
    },
    {
      "path": "ui/chat-backgrounds/chain_talk_bg_00010.png",
      "sha256": "2889a466742f347b47ba2bf5dd1d912ada8f825eb372cc1b4d2e1b95030cd4a6",
      "role": "chat_background"
    },
    {
      "path": "ui/chat-backgrounds/chain_talk_bg_00011.png",
      "sha256": "cfbc77ad993ea25d52a73feb13878cb98dea9d69e987962999f4c0fc80da50df",
      "role": "chat_background"
    },
    {
      "path": "ui/chat-backgrounds/chain_talk_bg_00012.png",
      "sha256": "4517bb0a3318e218b3b8d81c17e7d666b7387962a42fa7e79e6e847cb75657ef",
      "role": "chat_background"
    },
    {
      "path": "ui/chat-backgrounds/chain_talk_bg_00013.png",
      "sha256": "28866cd6a45f71ba23455394b6f8edee42dc75d2e43c4251dc41ede270c3ba0e",
      "role": "chat_background"
    },
    {
      "path": "ui/chat-backgrounds/chain_talk_bg_00014.png",
      "sha256": "f3cdb4232841c8c114607c3afe765736e170e859344e031e252fa288da2ab988",
      "role": "chat_background"
    },
    {
      "path": "ui/chat-backgrounds/chain_talk_bg_00015.png",
      "sha256": "8aac41343c406075657a4ae07df64d8e5beb02c78e128b7fc790d085d9d8de6e",
      "role": "chat_background"
    },
    {
      "path": "ui/chat-backgrounds/chain_talk_bg_00016.png",
      "sha256": "87bf2d252977b353cc229ffca4f09081dc7a34097baeeb50b6adc8252dfea399",
      "role": "chat_background"
    },
    {
      "path": "ui/chat-backgrounds/chain_talk_bg_00017.png",
      "sha256": "008b6b737700df95708aa8eaedcddd5c5cb2ed5bfccdf12f334e9a1173e2be42",
      "role": "chat_background"
    },
    {
      "path": "ui/chat-backgrounds/chain_talk_bg_00018.png",
      "sha256": "ac484569665e7439a5668141f5770d87223d46567c7bbfd2a8b5e59994d497f3",
      "role": "chat_background"
    },
    {
      "path": "ui/chat-backgrounds/chain_talk_bg_00019.png",